{"books":[{"ladder":{"asks":[],"bids":[{"own_orders":[{"displayed":"10","leaves":"10","order_id":"B1"}],"price":"100","quantity":"10"}],"phase":"Continuous"},"seq":"1","symbol":"TEST"},{"ladder":{"asks":[],"bids":[{"own_orders":[{"displayed":"10","leaves":"10","order_id":"B1"},{"displayed":"10","leaves":"10","order_id":"B2"}],"price":"100","quantity":"20"}],"phase":"Continuous"},"seq":"2","symbol":"TEST"},{"ladder":{"asks":[],"bids":[],"phase":"Continuous"},"seq":"3","symbol":"TEST"}],"events":[{"client_order_id":"c-B1","command_time":{"nanos":"0","seconds":"1"},"data":{"account":"","client_order_id":"c-B1","display_quantity":"0","expire_date":"","kind":"new","order_id":"B1","order_type":"2","owner":"alice","price":"100","quantity":"10","side":"1","stop_price":"0","stp_group":"","stp_mode":"0","time_in_force":"2"},"event_index":"0","global_seq":"1","kind":"command_received","order_id":"B1","owner":"alice","symbol":"TEST"},{"client_order_id":"c-B1","command_time":{"nanos":"0","seconds":"1"},"data":{"auction":false,"business_time":{"nanos":"0","seconds":"1"},"cause":"","client_order_id":"c-B1","counterparty":"","execution_id":"X1","leaves_quantity":"10","new_order_id":"","order_quantity":"10","orig_order_id":"","price":"0","quantity":"0","role":"not recorded"},"event_index":"1","global_seq":"1","kind":"accepted","order_id":"B1","owner":"alice","symbol":"TEST"},{"client_order_id":"c-B2","command_time":{"nanos":"0","seconds":"1"},"data":{"account":"","client_order_id":"c-B2","display_quantity":"0","expire_date":"","kind":"new","order_id":"B2","order_type":"2","owner":"alice","price":"100","quantity":"10","side":"1","stop_price":"0","stp_group":"","stp_mode":"0","time_in_force":"2"},"event_index":"0","global_seq":"2","kind":"command_received","order_id":"B2","owner":"alice","symbol":"TEST"},{"client_order_id":"c-B2","command_time":{"nanos":"0","seconds":"1"},"data":{"auction":false,"business_time":{"nanos":"0","seconds":"1"},"cause":"","client_order_id":"c-B2","counterparty":"","execution_id":"X2","leaves_quantity":"10","new_order_id":"","order_quantity":"10","orig_order_id":"","price":"0","quantity":"0","role":"not recorded"},"event_index":"1","global_seq":"2","kind":"accepted","order_id":"B2","owner":"alice","symbol":"TEST"},{"client_order_id":"mass-1","command_time":{"nanos":"0","seconds":"2"},"data":{"client_order_id":"mass-1","kind":"mass_cancel","owner":"alice","reason":"1","side":"0"},"event_index":"0","global_seq":"3","kind":"command_received","order_id":"","owner":"alice","symbol":"TEST"},{"client_order_id":"c-B1","command_time":{"nanos":"0","seconds":"2"},"data":{"auction":false,"business_time":{"nanos":"0","seconds":"2"},"cause":"mass cancel","client_order_id":"c-B1","counterparty":"","execution_id":"X3","leaves_quantity":"0","new_order_id":"","order_quantity":"10","orig_order_id":"","price":"0","quantity":"0","role":"not recorded"},"event_index":"1","global_seq":"3","kind":"canceled","order_id":"B1","owner":"alice","symbol":"TEST"},{"client_order_id":"c-B2","command_time":{"nanos":"0","seconds":"2"},"data":{"auction":false,"business_time":{"nanos":"0","seconds":"2"},"cause":"mass cancel","client_order_id":"c-B2","counterparty":"","execution_id":"X4","leaves_quantity":"0","new_order_id":"","order_quantity":"10","orig_order_id":"","price":"0","quantity":"0","role":"not recorded"},"event_index":"2","global_seq":"3","kind":"canceled","order_id":"B2","owner":"alice","symbol":"TEST"}],"manifest":{"bundle_format":"fxp-run-v1","canonical_version":"fxp-business-v1","commands_sha256":"a6063081ed92b7af01a342a6b2c1c954c13332ee1dda551691c7f361d17bdbcd","complete":true,"end_time":"0.000000000","fxp_version":"0.1.0","git_sha":"0000000000000000000000000000000000000000","meta":{"fixture":true},"proto_schema_sha256":"a909a9ff7e7380ef0974f861ec3ae76cd66b0bc7eda6b72493f24b5cee00a058","replay_version":"engine-input-v1","session_schedule":null,"start_time":"0.000000000","state_version":"fxp-state-v1","stp_default":"none","symbol_config_file":"symbols.csv","symbol_config_sha256":"e3b0c44298fc1c149afbf4c8996fb92427ae41e4649b934ca495991b7852b855","trace_sha256":"c5421b9f005632a2cc45c3f5d69148541dc845f0180c273868348568fdb41627","trace_version":"fxp-trace-v1"},"orders":[{"aliases":["B1"],"cancel_cause":"mass cancel","client_order_ids":["c-B1"],"explanation":"B1: 0 fill reports, 0 units; 0 stop triggers; 0 iceberg refreshes.\u000aTEST B1 owner=alice: canceled: mass cancel (first seq 3, count 1).\u000a","order_id":"B1","owner":"alice","positions":[["1","0"],["1","1"],["3","1"]],"reject_reason":"","status":"canceled","symbol":"TEST"},{"aliases":["B2"],"cancel_cause":"mass cancel","client_order_ids":["c-B2"],"explanation":"B2: 0 fill reports, 0 units; 0 stop triggers; 0 iceberg refreshes.\u000aTEST B2 owner=alice: canceled: mass cancel (first seq 3, count 1).\u000a","order_id":"B2","owner":"alice","positions":[["2","0"],["2","1"],["3","2"]],"reject_reason":"","status":"canceled","symbol":"TEST"}],"privacy":{"anonymized_owners":false,"selected_owner":"alice"},"schema":"fxp-run-report-v1","summary":{"cancels_by_cause":{"mass cancel":"2"},"fills":"0","orders":"2","owners":[{"cancels":"2","fill_reports":"0","orders":"2","owner":"alice","rejects":"0"}],"rejects_by_reason":{}},"symbols":["TEST"],"tape":[],"verification":{"actual":{"canonical_version":"fxp-business-v1","final_state_sha256":"0d9f977943149a3ee70d9499c89dbe43741faa117e2ab9599151bedd9317cdf3","global":{"count":"4","sha256":"0cb3eb4dc535560988b07380ae5d9b6e7c2c429dd79bf2eafe91e012a0a68447"},"state_version":"fxp-state-v1","symbols":{"TEST":{"count":"4","sha256":"0cb3eb4dc535560988b07380ae5d9b6e7c2c429dd79bf2eafe91e012a0a68447"}}},"expected":{"canonical_version":"fxp-business-v1","final_state_sha256":"0d9f977943149a3ee70d9499c89dbe43741faa117e2ab9599151bedd9317cdf3","global":{"count":"4","sha256":"0cb3eb4dc535560988b07380ae5d9b6e7c2c429dd79bf2eafe91e012a0a68447"},"state_version":"fxp-state-v1","symbols":{"TEST":{"count":"4","sha256":"0cb3eb4dc535560988b07380ae5d9b6e7c2c429dd79bf2eafe91e012a0a68447"}}},"first_divergence":null,"result":"identical","source":"recorded"},"window":{"boundary":"post-command journal sequence; tape/lifecycles windowed, summary whole run","from":"0","max_data_bytes":"100663296","max_rows":"100000","to":"3"}}
