{"books":[{"ladder":{"asks":[{"own_orders":[{"displayed":"10","leaves":"10","order_id":"S"}],"price":"100","quantity":"10"}],"bids":[],"phase":"Continuous"},"seq":"1","symbol":"TEST"}],"events":[{"client_order_id":"c-S","command_time":{"nanos":"0","seconds":"1"},"data":{"account":"","client_order_id":"c-S","display_quantity":"0","expire_date":"","kind":"new","order_id":"S","order_type":"2","owner":"alice","price":"100","quantity":"10","side":"2","stop_price":"0","stp_group":"","stp_mode":"0","time_in_force":"2"},"event_index":"0","global_seq":"1","kind":"command_received","order_id":"S","owner":"alice","symbol":"TEST"},{"client_order_id":"c-S","command_time":{"nanos":"0","seconds":"1"},"data":{"auction":false,"business_time":{"nanos":"0","seconds":"1"},"cause":"","client_order_id":"c-S","counterparty":"","execution_id":"X1","leaves_quantity":"10","new_order_id":"","order_quantity":"10","orig_order_id":"","price":"0","quantity":"0","role":"not recorded"},"event_index":"1","global_seq":"1","kind":"accepted","order_id":"S","owner":"alice","symbol":"TEST"},{"client_order_id":"c-B","command_time":{"nanos":"0","seconds":"2"},"data":{"account":"","client_order_id":"c-B","display_quantity":"0","expire_date":"","kind":"new","order_id":"B","order_type":"2","owner":"alice","price":"100","quantity":"5","side":"1","stop_price":"0","stp_group":"","stp_mode":"2","time_in_force":"2"},"event_index":"0","global_seq":"2","kind":"command_received","order_id":"B","owner":"alice","symbol":"TEST"},{"client_order_id":"c-B","command_time":{"nanos":"0","seconds":"2"},"data":{"auction":false,"business_time":{"nanos":"0","seconds":"2"},"cause":"","client_order_id":"c-B","counterparty":"","execution_id":"X2","leaves_quantity":"5","new_order_id":"","order_quantity":"5","orig_order_id":"","price":"0","quantity":"0","role":"not recorded"},"event_index":"1","global_seq":"2","kind":"accepted","order_id":"B","owner":"alice","symbol":"TEST"},{"client_order_id":"c-B","command_time":{"nanos":"0","seconds":"2"},"data":{"auction":false,"business_time":{"nanos":"0","seconds":"2"},"cause":"self-trade prevention (cancel-newest)","client_order_id":"c-B","counterparty":"","execution_id":"X3","leaves_quantity":"0","new_order_id":"","order_quantity":"5","orig_order_id":"","price":"0","quantity":"0","role":"not recorded"},"event_index":"2","global_seq":"2","kind":"canceled","order_id":"B","owner":"alice","symbol":"TEST"}],"manifest":{"bundle_format":"fxp-run-v1","canonical_version":"fxp-business-v1","commands_sha256":"5bc3cec8f10d83bb4e6fb22cb9fd2e41d92e5d7d60622879a4576824d68d08a4","complete":true,"end_time":"0.000000000","fxp_version":"0.1.0","git_sha":"0000000000000000000000000000000000000000","meta":{"fixture":true},"proto_schema_sha256":"a909a9ff7e7380ef0974f861ec3ae76cd66b0bc7eda6b72493f24b5cee00a058","replay_version":"engine-input-v1","session_schedule":null,"start_time":"0.000000000","state_version":"fxp-state-v1","stp_default":"none","symbol_config_file":"symbols.csv","symbol_config_sha256":"e3b0c44298fc1c149afbf4c8996fb92427ae41e4649b934ca495991b7852b855","trace_sha256":"cedc8c56cba0e9015dd144eb4a8ceaeb462dca69375dd38e345bbee8bdcf99ea","trace_version":"fxp-trace-v1"},"orders":[{"aliases":["S"],"cancel_cause":"","client_order_ids":["c-S"],"explanation":"S: 0 fill reports, 0 units; 0 stop triggers; 0 iceberg refreshes.\u000aNo terminal cause recorded in this scope.\u000a","order_id":"S","owner":"alice","positions":[["1","0"],["1","1"]],"reject_reason":"","status":"working","symbol":"TEST"},{"aliases":["B"],"cancel_cause":"self-trade prevention (cancel-newest)","client_order_ids":["c-B"],"explanation":"B: 0 fill reports, 0 units; 0 stop triggers; 0 iceberg refreshes.\u000aTEST B owner=alice: canceled: self-trade prevention (cancel-newest) (first seq 2, count 1).\u000a","order_id":"B","owner":"alice","positions":[["2","0"],["2","1"],["2","2"]],"reject_reason":"","status":"canceled","symbol":"TEST"}],"privacy":{"anonymized_owners":false,"selected_owner":"alice"},"schema":"fxp-run-report-v1","summary":{"cancels_by_cause":{"self-trade prevention (cancel-newest)":"1"},"fills":"0","orders":"2","owners":[{"cancels":"1","fill_reports":"0","orders":"2","owner":"alice","rejects":"0"}],"rejects_by_reason":{}},"symbols":["TEST"],"tape":[],"verification":{"actual":{"canonical_version":"fxp-business-v1","final_state_sha256":"c5d55d5a4bd6adbe8576ea7586f82b1a72cb4ec6407512309fe6d7160db8290c","global":{"count":"3","sha256":"e79adb345408d21169ad000444bfb05321961c986e1246aa65309306975fbcc6"},"state_version":"fxp-state-v1","symbols":{"TEST":{"count":"3","sha256":"e79adb345408d21169ad000444bfb05321961c986e1246aa65309306975fbcc6"}}},"expected":{"canonical_version":"fxp-business-v1","final_state_sha256":"c5d55d5a4bd6adbe8576ea7586f82b1a72cb4ec6407512309fe6d7160db8290c","global":{"count":"3","sha256":"e79adb345408d21169ad000444bfb05321961c986e1246aa65309306975fbcc6"},"state_version":"fxp-state-v1","symbols":{"TEST":{"count":"3","sha256":"e79adb345408d21169ad000444bfb05321961c986e1246aa65309306975fbcc6"}}},"first_divergence":null,"result":"identical","source":"recorded"},"window":{"boundary":"post-command journal sequence; tape/lifecycles windowed, summary whole run","from":"0","max_data_bytes":"100663296","max_rows":"100000","to":"2"}}
