{"books":[{"ladder":{"asks":[],"bids":[{"own_orders":[{"displayed":"10","leaves":"10","order_id":"B"}],"price":"100","quantity":"10"}],"phase":"Continuous"},"seq":"1","symbol":"TEST"},{"ladder":{"asks":[],"bids":[{"own_orders":[{"displayed":"12","leaves":"12","order_id":"B2"}],"price":"101","quantity":"12"}],"phase":"Continuous"},"seq":"2","symbol":"TEST"},{"ladder":{"asks":[],"bids":[],"phase":"Continuous"},"seq":"4","symbol":"TEST"}],"events":[{"client_order_id":"c-B","command_time":{"nanos":"0","seconds":"1"},"data":{"account":"","client_order_id":"c-B","display_quantity":"0","expire_date":"","kind":"new","order_id":"B","order_type":"2","owner":"alice","price":"100","quantity":"10","side":"1","stop_price":"0","stp_group":"","stp_mode":"0","time_in_force":"2"},"event_index":"0","global_seq":"1","kind":"command_received","order_id":"B","owner":"alice","symbol":"TEST"},{"client_order_id":"c-B","command_time":{"nanos":"0","seconds":"1"},"data":{"auction":false,"business_time":{"nanos":"0","seconds":"1"},"cause":"","client_order_id":"c-B","counterparty":"","execution_id":"X1","leaves_quantity":"10","new_order_id":"","order_quantity":"10","orig_order_id":"","price":"0","quantity":"0","role":"not recorded"},"event_index":"1","global_seq":"1","kind":"accepted","order_id":"B","owner":"alice","symbol":"TEST"},{"client_order_id":"replace-1","command_time":{"nanos":"0","seconds":"2"},"data":{"client_order_id":"replace-1","kind":"replace","new_display_quantity":"0","new_order_id":"B2","new_price":"101","new_quantity":"12","new_stop_price":"0","new_time_in_force":"0","order_id":"B","owner":"alice"},"event_index":"0","global_seq":"2","kind":"command_received","order_id":"B","owner":"alice","symbol":"TEST"},{"client_order_id":"replace-1","command_time":{"nanos":"0","seconds":"2"},"data":{"auction":false,"business_time":{"nanos":"0","seconds":"2"},"cause":"","client_order_id":"replace-1","counterparty":"","execution_id":"X2","leaves_quantity":"12","new_order_id":"B2","order_quantity":"12","orig_order_id":"B","price":"0","quantity":"0","role":"not recorded"},"event_index":"1","global_seq":"2","kind":"replaced","order_id":"B","owner":"alice","symbol":"TEST"},{"client_order_id":"replace-1","command_time":{"nanos":"0","seconds":"2"},"data":{"auction":false,"business_time":{"nanos":"0","seconds":"2"},"cause":"","client_order_id":"replace-1","counterparty":"","execution_id":"X3","leaves_quantity":"12","new_order_id":"","order_quantity":"12","orig_order_id":"B","price":"0","quantity":"0","role":"not recorded"},"event_index":"2","global_seq":"2","kind":"accepted","order_id":"B2","owner":"alice","symbol":"TEST"},{"client_order_id":"replace-bad","command_time":{"nanos":"0","seconds":"3"},"data":{"client_order_id":"replace-bad","kind":"replace","new_display_quantity":null,"new_order_id":"BAD","new_price":"0","new_quantity":"-1","new_stop_price":"0","new_time_in_force":"0","order_id":"B2","owner":"alice"},"event_index":"0","global_seq":"3","kind":"command_received","order_id":"B2","owner":"alice","symbol":"TEST"},{"client_order_id":"replace-bad","command_time":{"nanos":"0","seconds":"3"},"data":{"auction":false,"business_time":{"nanos":"0","seconds":"3"},"cause":"negative replace fields are invalid","client_order_id":"replace-bad","counterparty":"","execution_id":"X4","leaves_quantity":"0","new_order_id":"","order_quantity":"0","orig_order_id":"B2","price":"0","quantity":"0","role":"not recorded"},"event_index":"1","global_seq":"3","kind":"rejected","order_id":"B2","owner":"alice","symbol":"TEST"},{"client_order_id":"cancel-1","command_time":{"nanos":"0","seconds":"4"},"data":{"client_order_id":"cancel-1","kind":"cancel","order_id":"B2","owner":"alice"},"event_index":"0","global_seq":"4","kind":"command_received","order_id":"B2","owner":"alice","symbol":"TEST"},{"client_order_id":"cancel-1","command_time":{"nanos":"0","seconds":"4"},"data":{"auction":false,"business_time":{"nanos":"0","seconds":"4"},"cause":"user","client_order_id":"cancel-1","counterparty":"","execution_id":"X5","leaves_quantity":"0","new_order_id":"","order_quantity":"12","orig_order_id":"B2","price":"0","quantity":"0","role":"not recorded"},"event_index":"1","global_seq":"4","kind":"canceled","order_id":"B2","owner":"alice","symbol":"TEST"}],"manifest":{"bundle_format":"fxp-run-v1","canonical_version":"fxp-business-v1","commands_sha256":"03ec42a24d97c4f8015ef2df777e5765dcb68919acf218e8e1dfefcd0855a6c4","complete":true,"end_time":"0.000000000","fxp_version":"0.1.0","git_sha":"0000000000000000000000000000000000000000","meta":{"fixture":true},"proto_schema_sha256":"a909a9ff7e7380ef0974f861ec3ae76cd66b0bc7eda6b72493f24b5cee00a058","replay_version":"engine-input-v1","session_schedule":null,"start_time":"0.000000000","state_version":"fxp-state-v1","stp_default":"none","symbol_config_file":"symbols.csv","symbol_config_sha256":"e3b0c44298fc1c149afbf4c8996fb92427ae41e4649b934ca495991b7852b855","trace_sha256":"0f3e48a73a21c424a8d0ef4b52fe9488841d62e9a5c21065fa01314d5a748d2b","trace_version":"fxp-trace-v1"},"orders":[{"aliases":["B","B2"],"cancel_cause":"user","client_order_ids":["c-B","cancel-1","replace-1","replace-bad"],"explanation":"B: 0 fill reports, 0 units; 0 stop triggers; 0 iceberg refreshes.\u000aTEST B owner=alice: replaced: new order B2 (first seq 2, count 1).\u000aTEST B2 owner=alice: replace rejected: negative replace fields are invalid (first seq 3, count 1).\u000aTEST B2 owner=alice: canceled: user (first seq 4, count 1).\u000a","order_id":"B","owner":"alice","positions":[["1","0"],["1","1"],["2","0"],["2","1"],["2","2"],["3","0"],["3","1"],["4","0"],["4","1"]],"reject_reason":"negative replace fields are invalid","status":"canceled","symbol":"TEST"}],"privacy":{"anonymized_owners":false,"selected_owner":"alice"},"schema":"fxp-run-report-v1","summary":{"cancels_by_cause":{"user":"1"},"fills":"0","orders":"1","owners":[{"cancels":"1","fill_reports":"0","orders":"1","owner":"alice","rejects":"1"}],"rejects_by_reason":{"negative replace fields are invalid":"1"}},"symbols":["TEST"],"tape":[],"verification":{"actual":{"canonical_version":"fxp-business-v1","final_state_sha256":"e71f080dc11cc2c73a0f417216a4daab517123e20cd6ed07f924b63b85920a92","global":{"count":"5","sha256":"47a763cab08ff37b00ab6137a517ba0995831a6b0e6058c74b37c4b163d1966d"},"state_version":"fxp-state-v1","symbols":{"TEST":{"count":"5","sha256":"47a763cab08ff37b00ab6137a517ba0995831a6b0e6058c74b37c4b163d1966d"}}},"expected":{"canonical_version":"fxp-business-v1","final_state_sha256":"e71f080dc11cc2c73a0f417216a4daab517123e20cd6ed07f924b63b85920a92","global":{"count":"5","sha256":"47a763cab08ff37b00ab6137a517ba0995831a6b0e6058c74b37c4b163d1966d"},"state_version":"fxp-state-v1","symbols":{"TEST":{"count":"5","sha256":"47a763cab08ff37b00ab6137a517ba0995831a6b0e6058c74b37c4b163d1966d"}}},"first_divergence":null,"result":"identical","source":"recorded"},"window":{"boundary":"post-command journal sequence; tape/lifecycles windowed, summary whole run","from":"0","max_data_bytes":"100663296","max_rows":"100000","to":"4"}}
