{"books":[{"ladder":{"asks":[],"bids":[{"own_orders":[{"displayed":"10","leaves":"10","order_id":"DAY"}],"price":"100","quantity":"10"}],"phase":"Continuous"},"seq":"1","symbol":"TEST"},{"ladder":{"asks":[],"bids":[],"phase":"Continuous"},"seq":"2","symbol":"TEST"}],"events":[{"client_order_id":"c-DAY","command_time":{"nanos":"0","seconds":"1"},"data":{"account":"","client_order_id":"c-DAY","display_quantity":"0","expire_date":"","kind":"new","order_id":"DAY","order_type":"2","owner":"alice","price":"100","quantity":"10","side":"1","stop_price":"0","stp_group":"","stp_mode":"0","time_in_force":"1"},"event_index":"0","global_seq":"1","kind":"command_received","order_id":"DAY","owner":"alice","symbol":"TEST"},{"client_order_id":"c-DAY","command_time":{"nanos":"0","seconds":"1"},"data":{"auction":false,"business_time":{"nanos":"0","seconds":"1"},"cause":"","client_order_id":"c-DAY","counterparty":"","execution_id":"X1","leaves_quantity":"10","new_order_id":"","order_quantity":"10","orig_order_id":"","price":"0","quantity":"0","role":"not recorded"},"event_index":"1","global_seq":"1","kind":"accepted","order_id":"DAY","owner":"alice","symbol":"TEST"},{"client_order_id":"","command_time":{"nanos":"0","seconds":"6"},"data":{"kind":"tick"},"event_index":"0","global_seq":"2","kind":"command_received","order_id":"","owner":"","symbol":"TEST"},{"client_order_id":"c-DAY","command_time":{"nanos":"0","seconds":"6"},"data":{"auction":false,"business_time":{"nanos":"0","seconds":"5"},"cause":"expiry","client_order_id":"c-DAY","counterparty":"","execution_id":"X2","leaves_quantity":"0","new_order_id":"","order_quantity":"10","orig_order_id":"DAY","price":"0","quantity":"0","role":"not recorded"},"event_index":"1","global_seq":"2","kind":"expired","order_id":"DAY","owner":"alice","symbol":"TEST"}],"manifest":{"bundle_format":"fxp-run-v1","canonical_version":"fxp-business-v1","commands_sha256":"6e13e8f13de87d6710fbe921e94e44d1da51902261531f9eb9d5f528c1c3ac77","complete":true,"end_time":"0.000000000","fxp_version":"0.1.0","git_sha":"0000000000000000000000000000000000000000","meta":{"fixture":true},"proto_schema_sha256":"a909a9ff7e7380ef0974f861ec3ae76cd66b0bc7eda6b72493f24b5cee00a058","replay_version":"engine-input-v1","session_schedule":"close=00:00:05","start_time":"0.000000000","state_version":"fxp-state-v1","stp_default":"none","symbol_config_file":"symbols.csv","symbol_config_sha256":"e3b0c44298fc1c149afbf4c8996fb92427ae41e4649b934ca495991b7852b855","trace_sha256":"ec6f97a18629d1ef5041a8546eecfd158d4e5ad1619d0857652292f3e29e5517","trace_version":"fxp-trace-v1"},"orders":[{"aliases":["DAY"],"cancel_cause":"expiry","client_order_ids":["c-DAY"],"explanation":"DAY: 0 fill reports, 0 units; 0 stop triggers; 0 iceberg refreshes.\u000aTEST DAY owner=alice: expired: expiry (first seq 2, count 1).\u000a","order_id":"DAY","owner":"alice","positions":[["1","0"],["1","1"],["2","1"]],"reject_reason":"","status":"expired","symbol":"TEST"}],"privacy":{"anonymized_owners":false,"selected_owner":"alice"},"schema":"fxp-run-report-v1","summary":{"cancels_by_cause":{"expiry":"1"},"fills":"0","orders":"1","owners":[{"cancels":"1","fill_reports":"0","orders":"1","owner":"alice","rejects":"0"}],"rejects_by_reason":{}},"symbols":["TEST"],"tape":[],"verification":{"actual":{"canonical_version":"fxp-business-v1","final_state_sha256":"c9684112814d023cf631ee3c8b396de050474eb4f4d1c7349f38a4ff4fd79ea8","global":{"count":"2","sha256":"89b904404d636a667b9d0245b88c81b9aa034c050d7eb6b7c9d1523d95f88290"},"state_version":"fxp-state-v1","symbols":{"TEST":{"count":"2","sha256":"89b904404d636a667b9d0245b88c81b9aa034c050d7eb6b7c9d1523d95f88290"}}},"expected":{"canonical_version":"fxp-business-v1","final_state_sha256":"c9684112814d023cf631ee3c8b396de050474eb4f4d1c7349f38a4ff4fd79ea8","global":{"count":"2","sha256":"89b904404d636a667b9d0245b88c81b9aa034c050d7eb6b7c9d1523d95f88290"},"state_version":"fxp-state-v1","symbols":{"TEST":{"count":"2","sha256":"89b904404d636a667b9d0245b88c81b9aa034c050d7eb6b7c9d1523d95f88290"}}},"first_divergence":null,"result":"identical","source":"recorded"},"window":{"boundary":"post-command journal sequence; tape/lifecycles windowed, summary whole run","from":"0","max_data_bytes":"100663296","max_rows":"100000","to":"2"}}
