{"books":[{"ladder":{"asks":[{"own_orders":[],"price":"100","quantity":"20"}],"bids":[],"phase":"Continuous"},"seq":"1","symbol":"TEST"},{"ladder":{"asks":[{"own_orders":[],"price":"100","quantity":"14"}],"bids":[],"phase":"Continuous"},"seq":"3","symbol":"TEST"}],"events":[{"client_order_id":"c-S","command_time":{"nanos":"0","seconds":"1"},"data":{"account":"","client_order_id":"c-S","display_quantity":"0","expire_date":"","kind":"new","order_id":"S","order_type":"2","owner":"bob","price":"100","quantity":"20","side":"2","stop_price":"0","stp_group":"","stp_mode":"0","time_in_force":"2"},"event_index":"0","global_seq":"1","kind":"command_received","order_id":"S","owner":"bob","symbol":"TEST"},{"client_order_id":"c-S","command_time":{"nanos":"0","seconds":"1"},"data":{"auction":false,"business_time":{"nanos":"0","seconds":"1"},"cause":"","client_order_id":"c-S","counterparty":"","execution_id":"X1","leaves_quantity":"20","new_order_id":"","order_quantity":"20","orig_order_id":"","price":"0","quantity":"0","role":"not recorded"},"event_index":"1","global_seq":"1","kind":"accepted","order_id":"S","owner":"bob","symbol":"TEST"},{"client_order_id":"c-STOP","command_time":{"nanos":"0","seconds":"2"},"data":{"account":"","client_order_id":"c-STOP","display_quantity":"0","expire_date":"","kind":"new","order_id":"STOP","order_type":"3","owner":"alice","price":"100","quantity":"5","side":"1","stop_price":"100","stp_group":"","stp_mode":"0","time_in_force":"2"},"event_index":"0","global_seq":"2","kind":"command_received","order_id":"STOP","owner":"alice","symbol":"TEST"},{"client_order_id":"c-STOP","command_time":{"nanos":"0","seconds":"2"},"data":{"auction":false,"business_time":{"nanos":"0","seconds":"2"},"cause":"","client_order_id":"c-STOP","counterparty":"","execution_id":"X2","leaves_quantity":"5","new_order_id":"","order_quantity":"5","orig_order_id":"","price":"0","quantity":"0","role":"not recorded"},"event_index":"1","global_seq":"2","kind":"accepted","order_id":"STOP","owner":"alice","symbol":"TEST"},{"client_order_id":"c-TAKE","command_time":{"nanos":"0","seconds":"3"},"data":{"account":"","client_order_id":"c-TAKE","display_quantity":"0","expire_date":"","kind":"new","order_id":"TAKE","order_type":"2","owner":"carol","price":"100","quantity":"1","side":"1","stop_price":"0","stp_group":"","stp_mode":"0","time_in_force":"3"},"event_index":"0","global_seq":"3","kind":"command_received","order_id":"TAKE","owner":"carol","symbol":"TEST"},{"client_order_id":"c-TAKE","command_time":{"nanos":"0","seconds":"3"},"data":{"cause":"validated for matching","leaves_quantity":"1","order_quantity":"1"},"event_index":"1","global_seq":"3","kind":"accepted","order_id":"TAKE","owner":"carol","symbol":"TEST"},{"client_order_id":"c-TAKE","command_time":{"nanos":"0","seconds":"3"},"data":{"auction":false,"business_time":{"nanos":"0","seconds":"3"},"cause":"","client_order_id":"c-TAKE","counterparty":"anon:8de0b3c47f11","execution_id":"X3","leaves_quantity":"0","new_order_id":"","order_quantity":"1","orig_order_id":"","price":"100","quantity":"1","role":"aggressor"},"event_index":"2","global_seq":"3","kind":"fill","order_id":"TAKE","owner":"carol","symbol":"TEST"},{"client_order_id":"c-S","command_time":{"nanos":"0","seconds":"3"},"data":{"auction":false,"business_time":{"nanos":"0","seconds":"3"},"cause":"","client_order_id":"c-S","counterparty":"anon:7e56db773495","execution_id":"X4","leaves_quantity":"19","new_order_id":"","order_quantity":"20","orig_order_id":"","price":"100","quantity":"1","role":"resting"},"event_index":"3","global_seq":"3","kind":"fill","order_id":"S","owner":"bob","symbol":"TEST"},{"client_order_id":"","command_time":{"nanos":"0","seconds":"3"},"data":{"auction":false,"business_time":{"nanos":"0","seconds":"3"},"price":"100","quantity":"1","trade_id":"TEST:1"},"event_index":"4","global_seq":"3","kind":"trade","order_id":"","owner":"","symbol":"TEST"},{"client_order_id":"c-STOP","command_time":{"nanos":"0","seconds":"3"},"data":{"cause":"trade price crossed stop"},"event_index":"5","global_seq":"3","kind":"stop_trigger","order_id":"STOP","owner":"alice","symbol":"TEST"},{"client_order_id":"c-STOP","command_time":{"nanos":"0","seconds":"3"},"data":{"auction":false,"business_time":{"nanos":"0","seconds":"3"},"cause":"","client_order_id":"c-STOP","counterparty":"S","execution_id":"X5","leaves_quantity":"0","new_order_id":"","order_quantity":"5","orig_order_id":"","price":"100","quantity":"5","role":"aggressor"},"event_index":"6","global_seq":"3","kind":"fill","order_id":"STOP","owner":"alice","symbol":"TEST"},{"client_order_id":"c-S","command_time":{"nanos":"0","seconds":"3"},"data":{"auction":false,"business_time":{"nanos":"0","seconds":"3"},"cause":"","client_order_id":"c-S","counterparty":"anon:04dedf8afeb8","execution_id":"X6","leaves_quantity":"14","new_order_id":"","order_quantity":"20","orig_order_id":"","price":"100","quantity":"5","role":"resting"},"event_index":"7","global_seq":"3","kind":"fill","order_id":"S","owner":"bob","symbol":"TEST"},{"client_order_id":"","command_time":{"nanos":"0","seconds":"3"},"data":{"auction":false,"business_time":{"nanos":"0","seconds":"3"},"price":"100","quantity":"5","trade_id":"TEST:2"},"event_index":"8","global_seq":"3","kind":"trade","order_id":"","owner":"","symbol":"TEST"}],"manifest":{"bundle_format":"fxp-run-v1","canonical_version":"fxp-business-v1","commands_sha256":"f73892af769c088329a56dd7e21e543d279191ac231ba7ef0d87a00a84821027","complete":true,"end_time":"0.000000000","fxp_version":"0.1.0","git_sha":"0000000000000000000000000000000000000000","meta":{"fixture":true},"proto_schema_sha256":"a909a9ff7e7380ef0974f861ec3ae76cd66b0bc7eda6b72493f24b5cee00a058","replay_version":"engine-input-v1","session_schedule":null,"start_time":"0.000000000","state_version":"fxp-state-v1","stp_default":"none","symbol_config_file":"symbols.csv","symbol_config_sha256":"e3b0c44298fc1c149afbf4c8996fb92427ae41e4649b934ca495991b7852b855","trace_sha256":"a2506e23157fb80bbe8d7761da563f51dcc4b171fea7fc0ba025ce4d8b87e2a9","trace_version":"fxp-trace-v1"},"orders":[{"aliases":["S"],"cancel_cause":"","client_order_ids":["c-S"],"explanation":"S: 2 fill reports, 6 units; 0 stop triggers; 0 iceberg refreshes.\u000a","order_id":"S","owner":"bob","positions":[["1","0"],["1","1"],["3","3"],["3","7"]],"reject_reason":"","status":"partially_filled","symbol":"TEST"},{"aliases":["STOP"],"cancel_cause":"","client_order_ids":["c-STOP"],"explanation":"STOP: 1 fill reports, 5 units; 1 stop triggers; 0 iceberg refreshes.\u000a","order_id":"STOP","owner":"alice","positions":[["2","0"],["2","1"],["3","5"],["3","6"]],"reject_reason":"","status":"filled","symbol":"TEST"},{"aliases":["TAKE"],"cancel_cause":"","client_order_ids":["c-TAKE"],"explanation":"TAKE: 1 fill reports, 1 units; 0 stop triggers; 0 iceberg refreshes.\u000a","order_id":"TAKE","owner":"carol","positions":[["3","0"],["3","1"],["3","2"]],"reject_reason":"","status":"filled","symbol":"TEST"}],"privacy":{"anonymized_owners":false,"selected_owner":"alice"},"schema":"fxp-run-report-v1","summary":{"cancels_by_cause":{},"fills":"2","orders":"3","owners":[{"cancels":"0","fill_reports":"1","orders":"1","owner":"alice","rejects":"0"},{"cancels":"0","fill_reports":"2","orders":"1","owner":"bob","rejects":"0"},{"cancels":"0","fill_reports":"1","orders":"1","owner":"carol","rejects":"0"}],"rejects_by_reason":{}},"symbols":["TEST"],"tape":[{"client_order_id":"","command_time":{"nanos":"0","seconds":"3"},"data":{"auction":false,"business_time":{"nanos":"0","seconds":"3"},"price":"100","quantity":"1","trade_id":"TEST:1"},"event_index":"4","global_seq":"3","kind":"trade","order_id":"","owner":"","symbol":"TEST"},{"client_order_id":"","command_time":{"nanos":"0","seconds":"3"},"data":{"auction":false,"business_time":{"nanos":"0","seconds":"3"},"price":"100","quantity":"5","trade_id":"TEST:2"},"event_index":"8","global_seq":"3","kind":"trade","order_id":"","owner":"","symbol":"TEST"}],"verification":{"actual":{"canonical_version":"fxp-business-v1","final_state_sha256":"65215483dc3922792d8307c016e0516c8aef8449216e1eaaebb74d9aa1ef87ae","global":{"count":"8","sha256":"fcfab11d0c591fc4d02f7ecf5f1af2368f6483343ad0525e02823f7a0314c931"},"state_version":"fxp-state-v1","symbols":{"TEST":{"count":"8","sha256":"fcfab11d0c591fc4d02f7ecf5f1af2368f6483343ad0525e02823f7a0314c931"}}},"expected":{"canonical_version":"fxp-business-v1","final_state_sha256":"65215483dc3922792d8307c016e0516c8aef8449216e1eaaebb74d9aa1ef87ae","global":{"count":"8","sha256":"fcfab11d0c591fc4d02f7ecf5f1af2368f6483343ad0525e02823f7a0314c931"},"state_version":"fxp-state-v1","symbols":{"TEST":{"count":"8","sha256":"fcfab11d0c591fc4d02f7ecf5f1af2368f6483343ad0525e02823f7a0314c931"}}},"first_divergence":null,"result":"identical","source":"recorded"},"window":{"boundary":"post-command journal sequence; tape/lifecycles windowed, summary whole run","from":"0","max_data_bytes":"100663296","max_rows":"100000","to":"3"}}
