{"books":[{"ladder":{"asks":[],"bids":[{"own_orders":[{"displayed":"10","leaves":"10","order_id":"B"}],"price":"100","quantity":"10"}],"phase":"Continuous"},"seq":"1","symbol":"TEST"},{"ladder":{"asks":[],"bids":[{"own_orders":[{"displayed":"6","leaves":"6","order_id":"B"}],"price":"100","quantity":"6"}],"phase":"Continuous"},"seq":"2","symbol":"TEST"}],"events":[{"client_order_id":"c-B","command_time":{"nanos":"0","seconds":"1"},"data":{"account":"","client_order_id":"c-B","display_quantity":"0","expire_date":"","kind":"new","order_id":"B","order_type":"2","owner":"alice","price":"100","quantity":"10","side":"1","stop_price":"0","stp_group":"","stp_mode":"0","time_in_force":"2"},"event_index":"0","global_seq":"1","kind":"command_received","order_id":"B","owner":"alice","symbol":"TEST"},{"client_order_id":"c-B","command_time":{"nanos":"0","seconds":"1"},"data":{"auction":false,"business_time":{"nanos":"0","seconds":"1"},"cause":"","client_order_id":"c-B","counterparty":"","execution_id":"X1","leaves_quantity":"10","new_order_id":"","order_quantity":"10","orig_order_id":"","price":"0","quantity":"0","role":"not recorded"},"event_index":"1","global_seq":"1","kind":"accepted","order_id":"B","owner":"alice","symbol":"TEST"},{"client_order_id":"c-S","command_time":{"nanos":"0","seconds":"2"},"data":{"account":"","client_order_id":"c-S","display_quantity":"0","expire_date":"","kind":"new","order_id":"S","order_type":"2","owner":"bob","price":"100","quantity":"4","side":"2","stop_price":"0","stp_group":"","stp_mode":"0","time_in_force":"3"},"event_index":"0","global_seq":"2","kind":"command_received","order_id":"S","owner":"bob","symbol":"TEST"},{"client_order_id":"c-S","command_time":{"nanos":"0","seconds":"2"},"data":{"cause":"validated for matching","leaves_quantity":"4","order_quantity":"4"},"event_index":"1","global_seq":"2","kind":"accepted","order_id":"S","owner":"bob","symbol":"TEST"},{"client_order_id":"c-B","command_time":{"nanos":"0","seconds":"2"},"data":{"auction":false,"business_time":{"nanos":"0","seconds":"2"},"cause":"","client_order_id":"c-B","counterparty":"S","execution_id":"X2","leaves_quantity":"6","new_order_id":"","order_quantity":"10","orig_order_id":"","price":"100","quantity":"4","role":"resting"},"event_index":"2","global_seq":"2","kind":"fill","order_id":"B","owner":"alice","symbol":"TEST"},{"client_order_id":"c-S","command_time":{"nanos":"0","seconds":"2"},"data":{"auction":false,"business_time":{"nanos":"0","seconds":"2"},"cause":"","client_order_id":"c-S","counterparty":"anon:df7e70e50215","execution_id":"X3","leaves_quantity":"0","new_order_id":"","order_quantity":"4","orig_order_id":"","price":"100","quantity":"4","role":"aggressor"},"event_index":"3","global_seq":"2","kind":"fill","order_id":"S","owner":"bob","symbol":"TEST"},{"client_order_id":"","command_time":{"nanos":"0","seconds":"2"},"data":{"auction":false,"business_time":{"nanos":"0","seconds":"2"},"price":"100","quantity":"4","trade_id":"TEST:1"},"event_index":"4","global_seq":"2","kind":"trade","order_id":"","owner":"","symbol":"TEST"}],"manifest":{"bundle_format":"fxp-run-v1","canonical_version":"fxp-business-v1","commands_sha256":"8f318a081aa9fb575f3e680d60eb74527e52d84fba2a422a0db8b8aab2786d24","complete":true,"end_time":"0.000000000","fxp_version":"0.1.0","git_sha":"0000000000000000000000000000000000000000","meta":{"fixture":true},"proto_schema_sha256":"a909a9ff7e7380ef0974f861ec3ae76cd66b0bc7eda6b72493f24b5cee00a058","replay_version":"engine-input-v1","session_schedule":null,"start_time":"0.000000000","state_version":"fxp-state-v1","stp_default":"none","symbol_config_file":"symbols.csv","symbol_config_sha256":"e3b0c44298fc1c149afbf4c8996fb92427ae41e4649b934ca495991b7852b855","trace_sha256":"402b38ca9a351ae38a4205f863071adf8b41aa97b3dfdef4b10e60e78107b40d","trace_version":"fxp-trace-v1"},"orders":[{"aliases":["B"],"cancel_cause":"","client_order_ids":["c-B"],"explanation":"B: 1 fill reports, 4 units; 0 stop triggers; 0 iceberg refreshes.\u000a","order_id":"B","owner":"alice","positions":[["1","0"],["1","1"],["2","2"]],"reject_reason":"","status":"partially_filled","symbol":"TEST"},{"aliases":["S"],"cancel_cause":"","client_order_ids":["c-S"],"explanation":"S: 1 fill reports, 4 units; 0 stop triggers; 0 iceberg refreshes.\u000a","order_id":"S","owner":"bob","positions":[["2","0"],["2","1"],["2","3"]],"reject_reason":"","status":"filled","symbol":"TEST"}],"privacy":{"anonymized_owners":false,"selected_owner":"alice"},"schema":"fxp-run-report-v1","summary":{"cancels_by_cause":{},"fills":"1","orders":"2","owners":[{"cancels":"0","fill_reports":"1","orders":"1","owner":"alice","rejects":"0"},{"cancels":"0","fill_reports":"1","orders":"1","owner":"bob","rejects":"0"}],"rejects_by_reason":{}},"symbols":["TEST"],"tape":[{"client_order_id":"","command_time":{"nanos":"0","seconds":"2"},"data":{"auction":false,"business_time":{"nanos":"0","seconds":"2"},"price":"100","quantity":"4","trade_id":"TEST:1"},"event_index":"4","global_seq":"2","kind":"trade","order_id":"","owner":"","symbol":"TEST"}],"verification":{"actual":{"canonical_version":"fxp-business-v1","final_state_sha256":"6eec2ee3b5b1a6b5c132f1087307ff5549b416e8d6dc08141b57c17d79c1697b","global":{"count":"4","sha256":"4a3726a331d47078c7405f4777860fca93ce8998c73a8225dc3457b5ecc2d24b"},"state_version":"fxp-state-v1","symbols":{"TEST":{"count":"4","sha256":"4a3726a331d47078c7405f4777860fca93ce8998c73a8225dc3457b5ecc2d24b"}}},"expected":{"canonical_version":"fxp-business-v1","final_state_sha256":"6eec2ee3b5b1a6b5c132f1087307ff5549b416e8d6dc08141b57c17d79c1697b","global":{"count":"4","sha256":"4a3726a331d47078c7405f4777860fca93ce8998c73a8225dc3457b5ecc2d24b"},"state_version":"fxp-state-v1","symbols":{"TEST":{"count":"4","sha256":"4a3726a331d47078c7405f4777860fca93ce8998c73a8225dc3457b5ecc2d24b"}}},"first_divergence":null,"result":"identical","source":"recorded"},"window":{"boundary":"post-command journal sequence; tape/lifecycles windowed, summary whole run","from":"0","max_data_bytes":"100663296","max_rows":"100000","to":"2"}}
