{"books":[{"ladder":{"asks":[{"own_orders":[],"price":"100","quantity":"2"}],"bids":[],"phase":"Continuous"},"seq":"1","symbol":"TEST"},{"ladder":{"asks":[{"own_orders":[],"price":"100","quantity":"1"}],"bids":[],"phase":"Continuous"},"seq":"2","symbol":"TEST"}],"events":[{"client_order_id":"c-ICE","command_time":{"nanos":"0","seconds":"1"},"data":{"account":"","client_order_id":"c-ICE","display_quantity":"2","expire_date":"","kind":"new","order_id":"ICE","order_type":"2","owner":"bob","price":"100","quantity":"8","side":"2","stop_price":"0","stp_group":"","stp_mode":"0","time_in_force":"2"},"event_index":"0","global_seq":"1","kind":"command_received","order_id":"ICE","owner":"bob","symbol":"TEST"},{"client_order_id":"c-ICE","command_time":{"nanos":"0","seconds":"1"},"data":{"auction":false,"business_time":{"nanos":"0","seconds":"1"},"cause":"","client_order_id":"c-ICE","counterparty":"","execution_id":"X1","leaves_quantity":"8","new_order_id":"","order_quantity":"8","orig_order_id":"","price":"0","quantity":"0","role":"not recorded"},"event_index":"1","global_seq":"1","kind":"accepted","order_id":"ICE","owner":"bob","symbol":"TEST"},{"client_order_id":"c-B","command_time":{"nanos":"0","seconds":"2"},"data":{"account":"","client_order_id":"c-B","display_quantity":"0","expire_date":"","kind":"new","order_id":"B","order_type":"2","owner":"alice","price":"100","quantity":"5","side":"1","stop_price":"0","stp_group":"","stp_mode":"0","time_in_force":"3"},"event_index":"0","global_seq":"2","kind":"command_received","order_id":"B","owner":"alice","symbol":"TEST"},{"client_order_id":"c-B","command_time":{"nanos":"0","seconds":"2"},"data":{"cause":"validated for matching","leaves_quantity":"5","order_quantity":"5"},"event_index":"1","global_seq":"2","kind":"accepted","order_id":"B","owner":"alice","symbol":"TEST"},{"client_order_id":"c-B","command_time":{"nanos":"0","seconds":"2"},"data":{"auction":false,"business_time":{"nanos":"0","seconds":"2"},"cause":"","client_order_id":"c-B","counterparty":"ICE","execution_id":"X2","leaves_quantity":"3","new_order_id":"","order_quantity":"5","orig_order_id":"","price":"100","quantity":"2","role":"aggressor"},"event_index":"2","global_seq":"2","kind":"fill","order_id":"B","owner":"alice","symbol":"TEST"},{"client_order_id":"c-ICE","command_time":{"nanos":"0","seconds":"2"},"data":{"auction":false,"business_time":{"nanos":"0","seconds":"2"},"cause":"","client_order_id":"c-ICE","counterparty":"anon:df7e70e50215","execution_id":"X3","leaves_quantity":"6","new_order_id":"","order_quantity":"8","orig_order_id":"","price":"100","quantity":"2","role":"resting"},"event_index":"3","global_seq":"2","kind":"fill","order_id":"ICE","owner":"bob","symbol":"TEST"},{"client_order_id":"","command_time":{"nanos":"0","seconds":"2"},"data":{"auction":false,"business_time":{"nanos":"0","seconds":"2"},"price":"100","quantity":"2","trade_id":"TEST:1"},"event_index":"4","global_seq":"2","kind":"trade","order_id":"","owner":"","symbol":"TEST"},{"client_order_id":"c-ICE","command_time":{"nanos":"0","seconds":"2"},"data":{"cause":"displayed slice exhausted; reserve replenished at back of queue","quantity":"2"},"event_index":"5","global_seq":"2","kind":"iceberg_refresh","order_id":"ICE","owner":"bob","symbol":"TEST"},{"client_order_id":"c-B","command_time":{"nanos":"0","seconds":"2"},"data":{"auction":false,"business_time":{"nanos":"0","seconds":"2"},"cause":"","client_order_id":"c-B","counterparty":"ICE","execution_id":"X4","leaves_quantity":"1","new_order_id":"","order_quantity":"5","orig_order_id":"","price":"100","quantity":"2","role":"aggressor"},"event_index":"6","global_seq":"2","kind":"fill","order_id":"B","owner":"alice","symbol":"TEST"},{"client_order_id":"c-ICE","command_time":{"nanos":"0","seconds":"2"},"data":{"auction":false,"business_time":{"nanos":"0","seconds":"2"},"cause":"","client_order_id":"c-ICE","counterparty":"anon:df7e70e50215","execution_id":"X5","leaves_quantity":"4","new_order_id":"","order_quantity":"8","orig_order_id":"","price":"100","quantity":"2","role":"resting"},"event_index":"7","global_seq":"2","kind":"fill","order_id":"ICE","owner":"bob","symbol":"TEST"},{"client_order_id":"","command_time":{"nanos":"0","seconds":"2"},"data":{"auction":false,"business_time":{"nanos":"0","seconds":"2"},"price":"100","quantity":"2","trade_id":"TEST:2"},"event_index":"8","global_seq":"2","kind":"trade","order_id":"","owner":"","symbol":"TEST"},{"client_order_id":"c-ICE","command_time":{"nanos":"0","seconds":"2"},"data":{"cause":"displayed slice exhausted; reserve replenished at back of queue","quantity":"2"},"event_index":"9","global_seq":"2","kind":"iceberg_refresh","order_id":"ICE","owner":"bob","symbol":"TEST"},{"client_order_id":"c-B","command_time":{"nanos":"0","seconds":"2"},"data":{"auction":false,"business_time":{"nanos":"0","seconds":"2"},"cause":"","client_order_id":"c-B","counterparty":"ICE","execution_id":"X6","leaves_quantity":"0","new_order_id":"","order_quantity":"5","orig_order_id":"","price":"100","quantity":"1","role":"aggressor"},"event_index":"10","global_seq":"2","kind":"fill","order_id":"B","owner":"alice","symbol":"TEST"},{"client_order_id":"c-ICE","command_time":{"nanos":"0","seconds":"2"},"data":{"auction":false,"business_time":{"nanos":"0","seconds":"2"},"cause":"","client_order_id":"c-ICE","counterparty":"anon:df7e70e50215","execution_id":"X7","leaves_quantity":"3","new_order_id":"","order_quantity":"8","orig_order_id":"","price":"100","quantity":"1","role":"resting"},"event_index":"11","global_seq":"2","kind":"fill","order_id":"ICE","owner":"bob","symbol":"TEST"},{"client_order_id":"","command_time":{"nanos":"0","seconds":"2"},"data":{"auction":false,"business_time":{"nanos":"0","seconds":"2"},"price":"100","quantity":"1","trade_id":"TEST:3"},"event_index":"12","global_seq":"2","kind":"trade","order_id":"","owner":"","symbol":"TEST"}],"manifest":{"bundle_format":"fxp-run-v1","canonical_version":"fxp-business-v1","commands_sha256":"6b92c7aa65cc523fb8e1f59c87f4ba99b3ca1c59af4abf726864e5f8e2f142a1","complete":true,"end_time":"0.000000000","fxp_version":"0.1.0","git_sha":"0000000000000000000000000000000000000000","meta":{"fixture":true},"proto_schema_sha256":"a909a9ff7e7380ef0974f861ec3ae76cd66b0bc7eda6b72493f24b5cee00a058","replay_version":"engine-input-v1","session_schedule":null,"start_time":"0.000000000","state_version":"fxp-state-v1","stp_default":"none","symbol_config_file":"symbols.csv","symbol_config_sha256":"e3b0c44298fc1c149afbf4c8996fb92427ae41e4649b934ca495991b7852b855","trace_sha256":"27aa51d307d38c2f345eae95b7646520911f59226487a2f10807b0cc5aab5197","trace_version":"fxp-trace-v1"},"orders":[{"aliases":["ICE"],"cancel_cause":"","client_order_ids":["c-ICE"],"explanation":"ICE: 3 fill reports, 5 units; 0 stop triggers; 2 iceberg refreshes.\u000a","order_id":"ICE","owner":"bob","positions":[["1","0"],["1","1"],["2","3"],["2","5"],["2","7"],["2","9"],["2","11"]],"reject_reason":"","status":"partially_filled","symbol":"TEST"},{"aliases":["B"],"cancel_cause":"","client_order_ids":["c-B"],"explanation":"B: 3 fill reports, 5 units; 0 stop triggers; 0 iceberg refreshes.\u000a","order_id":"B","owner":"alice","positions":[["2","0"],["2","1"],["2","2"],["2","6"],["2","10"]],"reject_reason":"","status":"filled","symbol":"TEST"}],"privacy":{"anonymized_owners":false,"selected_owner":"alice"},"schema":"fxp-run-report-v1","summary":{"cancels_by_cause":{},"fills":"3","orders":"2","owners":[{"cancels":"0","fill_reports":"3","orders":"1","owner":"alice","rejects":"0"},{"cancels":"0","fill_reports":"3","orders":"1","owner":"bob","rejects":"0"}],"rejects_by_reason":{}},"symbols":["TEST"],"tape":[{"client_order_id":"","command_time":{"nanos":"0","seconds":"2"},"data":{"auction":false,"business_time":{"nanos":"0","seconds":"2"},"price":"100","quantity":"2","trade_id":"TEST:1"},"event_index":"4","global_seq":"2","kind":"trade","order_id":"","owner":"","symbol":"TEST"},{"client_order_id":"","command_time":{"nanos":"0","seconds":"2"},"data":{"auction":false,"business_time":{"nanos":"0","seconds":"2"},"price":"100","quantity":"2","trade_id":"TEST:2"},"event_index":"8","global_seq":"2","kind":"trade","order_id":"","owner":"","symbol":"TEST"},{"client_order_id":"","command_time":{"nanos":"0","seconds":"2"},"data":{"auction":false,"business_time":{"nanos":"0","seconds":"2"},"price":"100","quantity":"1","trade_id":"TEST:3"},"event_index":"12","global_seq":"2","kind":"trade","order_id":"","owner":"","symbol":"TEST"}],"verification":{"actual":{"canonical_version":"fxp-business-v1","final_state_sha256":"660c7bc46a8026b421c18b2e5c2119f99117fc80e30a94cd77b3720fc890e254","global":{"count":"10","sha256":"ab6c146310d8f68ed0bdb6f55447e64315eb02df75a0e3b58c375fd0bb2c1015"},"state_version":"fxp-state-v1","symbols":{"TEST":{"count":"10","sha256":"ab6c146310d8f68ed0bdb6f55447e64315eb02df75a0e3b58c375fd0bb2c1015"}}},"expected":{"canonical_version":"fxp-business-v1","final_state_sha256":"660c7bc46a8026b421c18b2e5c2119f99117fc80e30a94cd77b3720fc890e254","global":{"count":"10","sha256":"ab6c146310d8f68ed0bdb6f55447e64315eb02df75a0e3b58c375fd0bb2c1015"},"state_version":"fxp-state-v1","symbols":{"TEST":{"count":"10","sha256":"ab6c146310d8f68ed0bdb6f55447e64315eb02df75a0e3b58c375fd0bb2c1015"}}},"first_divergence":null,"result":"identical","source":"recorded"},"window":{"boundary":"post-command journal sequence; tape/lifecycles windowed, summary whole run","from":"0","max_data_bytes":"100663296","max_rows":"100000","to":"2"}}
