{"books":[{"ladder":{"asks":[],"bids":[{"own_orders":[{"displayed":"10","leaves":"10","order_id":"B"}],"price":"100","quantity":"10"}],"phase":"OpeningCall"},"seq":"1","symbol":"TEST"},{"ladder":{"asks":[{"own_orders":[],"price":"100","quantity":"3"}],"bids":[{"own_orders":[{"displayed":"10","leaves":"10","order_id":"B"}],"price":"100","quantity":"10"}],"phase":"OpeningCall"},"seq":"2","symbol":"TEST"},{"ladder":{"asks":[],"bids":[],"phase":"Continuous"},"seq":"3","symbol":"TEST"}],"events":[{"client_order_id":"c-B","command_time":{"nanos":"0","seconds":"2"},"data":{"account":"","client_order_id":"c-B","display_quantity":"0","expire_date":"","kind":"new","order_id":"B","order_type":"2","owner":"alice","price":"100","quantity":"10","side":"1","stop_price":"0","stp_group":"","stp_mode":"0","time_in_force":"5"},"event_index":"0","global_seq":"1","kind":"command_received","order_id":"B","owner":"alice","symbol":"TEST"},{"client_order_id":"c-B","command_time":{"nanos":"0","seconds":"2"},"data":{"auction":false,"business_time":{"nanos":"0","seconds":"2"},"cause":"","client_order_id":"c-B","counterparty":"","execution_id":"X1","leaves_quantity":"10","new_order_id":"","order_quantity":"10","orig_order_id":"","price":"0","quantity":"0","role":"not recorded"},"event_index":"1","global_seq":"1","kind":"accepted","order_id":"B","owner":"alice","symbol":"TEST"},{"client_order_id":"","command_time":{"nanos":"0","seconds":"2"},"data":{"business_time":{"nanos":"0","seconds":"2"},"price":"0","quantity":"0"},"event_index":"2","global_seq":"1","kind":"auction","order_id":"","owner":"","symbol":"TEST"},{"client_order_id":"c-S","command_time":{"nanos":"0","seconds":"2"},"data":{"account":"","client_order_id":"c-S","display_quantity":"0","expire_date":"","kind":"new","order_id":"S","order_type":"2","owner":"bob","price":"100","quantity":"3","side":"2","stop_price":"0","stp_group":"","stp_mode":"0","time_in_force":"5"},"event_index":"0","global_seq":"2","kind":"command_received","order_id":"S","owner":"bob","symbol":"TEST"},{"client_order_id":"c-S","command_time":{"nanos":"0","seconds":"2"},"data":{"auction":false,"business_time":{"nanos":"0","seconds":"2"},"cause":"","client_order_id":"c-S","counterparty":"","execution_id":"X2","leaves_quantity":"3","new_order_id":"","order_quantity":"3","orig_order_id":"","price":"0","quantity":"0","role":"not recorded"},"event_index":"1","global_seq":"2","kind":"accepted","order_id":"S","owner":"bob","symbol":"TEST"},{"client_order_id":"","command_time":{"nanos":"0","seconds":"2"},"data":{"business_time":{"nanos":"0","seconds":"2"},"price":"100","quantity":"3"},"event_index":"2","global_seq":"2","kind":"auction","order_id":"","owner":"","symbol":"TEST"},{"client_order_id":"","command_time":{"nanos":"0","seconds":"6"},"data":{"kind":"tick"},"event_index":"0","global_seq":"3","kind":"command_received","order_id":"","owner":"","symbol":"TEST"},{"client_order_id":"c-B","command_time":{"nanos":"0","seconds":"6"},"data":{"auction":true,"business_time":{"nanos":"0","seconds":"5"},"cause":"","client_order_id":"c-B","counterparty":"S","execution_id":"X3","leaves_quantity":"7","new_order_id":"","order_quantity":"10","orig_order_id":"","price":"100","quantity":"3","role":"auction"},"event_index":"1","global_seq":"3","kind":"fill","order_id":"B","owner":"alice","symbol":"TEST"},{"client_order_id":"c-S","command_time":{"nanos":"0","seconds":"6"},"data":{"auction":true,"business_time":{"nanos":"0","seconds":"5"},"cause":"","client_order_id":"c-S","counterparty":"anon:df7e70e50215","execution_id":"X4","leaves_quantity":"0","new_order_id":"","order_quantity":"3","orig_order_id":"","price":"100","quantity":"3","role":"auction"},"event_index":"2","global_seq":"3","kind":"fill","order_id":"S","owner":"bob","symbol":"TEST"},{"client_order_id":"","command_time":{"nanos":"0","seconds":"6"},"data":{"auction":true,"business_time":{"nanos":"0","seconds":"5"},"price":"100","quantity":"3","trade_id":"TEST:1"},"event_index":"3","global_seq":"3","kind":"trade","order_id":"","owner":"","symbol":"TEST"},{"client_order_id":"c-B","command_time":{"nanos":"0","seconds":"6"},"data":{"auction":false,"business_time":{"nanos":"0","seconds":"5"},"cause":"auction remainder","client_order_id":"c-B","counterparty":"","execution_id":"X5","leaves_quantity":"0","new_order_id":"","order_quantity":"10","orig_order_id":"B","price":"0","quantity":"0","role":"not recorded"},"event_index":"4","global_seq":"3","kind":"canceled","order_id":"B","owner":"alice","symbol":"TEST"},{"client_order_id":"","command_time":{"nanos":"0","seconds":"6"},"data":{"business_time":{"nanos":"0","seconds":"5"},"phase":"3"},"event_index":"5","global_seq":"3","kind":"phase","order_id":"","owner":"","symbol":"TEST"}],"manifest":{"bundle_format":"fxp-run-v1","canonical_version":"fxp-business-v1","commands_sha256":"a9892427d0513131117625358624c2c8d2779c6c866704e4e57405362b226ee3","complete":true,"end_time":"0.000000000","fxp_version":"0.1.0","git_sha":"0000000000000000000000000000000000000000","meta":{"fixture":true},"proto_schema_sha256":"a909a9ff7e7380ef0974f861ec3ae76cd66b0bc7eda6b72493f24b5cee00a058","replay_version":"engine-input-v1","session_schedule":"open_call=00:00:01,open=00:00:05,close_call=00:00:10,close=00:00:15","start_time":"0.000000000","state_version":"fxp-state-v1","stp_default":"none","symbol_config_file":"symbols.csv","symbol_config_sha256":"e3b0c44298fc1c149afbf4c8996fb92427ae41e4649b934ca495991b7852b855","trace_sha256":"4de309a06c4190fd2f1585608a9fb3e88a52325ea5e01e9bc7fe8281d44a18eb","trace_version":"fxp-trace-v1"},"orders":[{"aliases":["B"],"cancel_cause":"auction remainder","client_order_ids":["c-B"],"explanation":"B: 1 fill reports, 3 units; 0 stop triggers; 0 iceberg refreshes.\u000aAuction fill at price 100 (seq 3).\u000aTEST B owner=alice: canceled: auction remainder (first seq 3, count 1).\u000a","order_id":"B","owner":"alice","positions":[["1","0"],["1","1"],["3","1"],["3","4"]],"reject_reason":"","status":"canceled","symbol":"TEST"},{"aliases":["S"],"cancel_cause":"","client_order_ids":["c-S"],"explanation":"S: 1 fill reports, 3 units; 0 stop triggers; 0 iceberg refreshes.\u000aAuction fill at price 100 (seq 3).\u000a","order_id":"S","owner":"bob","positions":[["2","0"],["2","1"],["3","2"]],"reject_reason":"","status":"filled","symbol":"TEST"}],"privacy":{"anonymized_owners":false,"selected_owner":"alice"},"schema":"fxp-run-report-v1","summary":{"cancels_by_cause":{"auction remainder":"1"},"fills":"1","orders":"2","owners":[{"cancels":"1","fill_reports":"1","orders":"1","owner":"alice","rejects":"0"},{"cancels":"0","fill_reports":"1","orders":"1","owner":"bob","rejects":"0"}],"rejects_by_reason":{}},"symbols":["TEST"],"tape":[{"client_order_id":"","command_time":{"nanos":"0","seconds":"6"},"data":{"auction":true,"business_time":{"nanos":"0","seconds":"5"},"price":"100","quantity":"3","trade_id":"TEST:1"},"event_index":"3","global_seq":"3","kind":"trade","order_id":"","owner":"","symbol":"TEST"}],"verification":{"actual":{"canonical_version":"fxp-business-v1","final_state_sha256":"54d1f7305bd5f74aea645e2cf04baf351b815194cc3a8035fa2d78881d4bf40d","global":{"count":"9","sha256":"474a66de912712c8fbda5002f0b548c25cfe4a77147c7d561eae95f85be025a8"},"state_version":"fxp-state-v1","symbols":{"TEST":{"count":"9","sha256":"474a66de912712c8fbda5002f0b548c25cfe4a77147c7d561eae95f85be025a8"}}},"expected":{"canonical_version":"fxp-business-v1","final_state_sha256":"54d1f7305bd5f74aea645e2cf04baf351b815194cc3a8035fa2d78881d4bf40d","global":{"count":"9","sha256":"474a66de912712c8fbda5002f0b548c25cfe4a77147c7d561eae95f85be025a8"},"state_version":"fxp-state-v1","symbols":{"TEST":{"count":"9","sha256":"474a66de912712c8fbda5002f0b548c25cfe4a77147c7d561eae95f85be025a8"}}},"first_divergence":null,"result":"identical","source":"recorded"},"window":{"boundary":"post-command journal sequence; tape/lifecycles windowed, summary whole run","from":"0","max_data_bytes":"100663296","max_rows":"100000","to":"3"}}
